hinglish,hinglish_dev,english,english_pred
RT @AamirMeriJaan : @Jammy_PK @JahanurAamir @yganesh0208 @mana_apple wahan bahut logon ke naam hain Jo abuse karte ... not talking abt girls .,आरटी @आमिरमेरिजान : @जैमी_पीके @जहानुरामिर @यज्ञेश०२०८ @माना_एपल वाहन बहुत लोगों के नाम हैं जो एब्यूज करते ... नोट टॉकिंग अब्त गर्ल्स ।,RT @AamirMeriJaan : @Jammy_PK @JahanurAamir @yganesh0208 @mana_apple there are many names here of people who abuse ... not talking about girls .,RT @आमिरमेरिजान: @जैमी_पीके @जहानुरामिर @यज्ञेश0208 @माना_एपल Vehicles are the names of many people who abuse... Not Talking About Girls.
High 5 bhai!!,हाई ५ भाई!!,high 5 bhai!!,Hi 5 brothers!!
bhai tu delhi aaja.. badiya sasti daaru.. itna badiya khaana... aur yaha har baat pe zingaat bhi nahi chalata koi,भाई टू डेल्ही आजा.. बडिया सस्ती दारू.. इतना बडिया खाना... और याहा हर बात पे ज़िंगाट भी नही चलता कोई,bro just come to delhi.. cheap beer.. good food ... and no one takes out swords for little things here,Bhai to Delhi aaja.. badiya sasti daru.. itna badiya khana.. aur yaha har baat pe zingaat bhi nahi chalta koi.
and then on tuesday &amp,एंड थें ओन ट्यूजडे &एएमपी, wednesday its champions league match day 4 i think ?  ?  or it might be 5 .  . im not sure wooooo hooooo,And Then On Tueday & AMP
"""Mubarak ho tu chacha ban gaya. Bhai khushi double ho gayi, bitiya hui hai""
 
 Most beautiful line I have heard this year.","""मुबारक हो टू चाचा बन गया. भाई खुशी डबल हो गयी, बिटिया हुई है""
 
 मोस्ट ब्यूटीफुल लाइन आई हेव हर्ड थिस यर.","“congratulations, you became an uncle. the happiness has doubled. i have a daughter now”
 
 most beautiful line I have heard this year.","""Mubarak ho to chacha ban gaya. Bhai khushi double ho gayi, biti hui hai"" Most beautiful line I have heard this year."
"RT @abhijix : He : Hi , kaisi hai ? She : Mast , tu bata He : Hmm , tu paragon .. v2406 @bhattkaran83 @iambmane @pg27693 @hbparmar211 http://t.co/cOz","आरटी @अभिजिक्स : हे : ही , कैसी है ? शे : मस्त , टू बता हे : हम्म , टू पैरागन .. व२४०६ @भट्टकरण८३ @आईएमबीमाने @पीजी२७६९३ @एचबीपीएआरमार२११ एचटीटीपी://टी.सीओ/कोज","@abhijix : he : hi, how are you? she : fine, how are you he: hmm, you paragon. v2406 @bhattkaran83 @iambmane @pg27693 @hbparmar211 http://t.co/cOz","RT @अभिजिक्स: Hey, how are you? Shemast, to tell you: Hmm, to Paragon.. and 2406 @भट्टकरण83 @आईएमबीमाने @पीजी27693 @एचबीपीएआरमार211 HTTP: / / T.CO / Coz"
@kitAnurag shakal ka dosh hai. Mere saath bhi hota hai,@कीटाणुराग शकल का दोष है. मेरे साथ भी होता है,@kitAnurag It is fault of the face. Happens with me too.,@कीटाणुराग is Shakal's fault. It happens to me too
"#ModiScaredOfSonia it's not about Modi ji , every citizen of India scared of Sonia ..","#मोडिस्केयरडोफसोनिया इट'एस नोट अबाउट मोदी जी , एवरी सिटीजन ओएफ इंडिया स्केयर्ड ओएफ सोनिया ..","#ModiScaredOfSonia it's not about Modi sir , every citizen of India scared of Sonia ..","#मोडिस्केयरडोफसोनिया It's not about Modi ji, every citizen of India is scared of Sonia ji."
haha true .  .  .  . wo 4 games hi bar bar repeat hote the .  .,हाहा ट्रू .  .  .  . वो ४ गेम्स ही बार बार रिपीट होते थे .  ।,haha true .  .  .  . wo 4 games hi bar bar repeat hote the .  .,Haha true... those 4 games were the only repeats.
Kuch bhi ho is baar Patakhe hum hi fodege ! Watch the new #Mauka TVC by @StarSportsIndia #IndvsSA http://t.co/zwNsKvQ0Cs,कुच भी हो इस बार पटाखे हम ही फोड़ेगे ! वॉच थे न्यू #मौका टीवीसी बी @स्टारस्पोर्टसिंडिया #इंडवासा एचटीटीपी://टी.सीओ/ज़्वानस्क्वीक०सीएस,"whatever happens, we will burst firecrackers this time! watch the new #Mauka tvc by @StarSportsIndia #IndvsSA",This time we will burst crackers! Watch was NEW #मौका TVC B @स्टारस्पोर्टसिंडिया #इंडवासा HTTP: / / T.CO / Zvansquick0CS
"@witchybitchygal ""Ye dharti meri meme hai meme"" @Atheist_Krishnapic.twitter.com/scVhuxg7YG","@विचीबिचीगल ""ये धरती मेरी मेमे है मेमे"" @एथीस्ट_कृष्णपिक.ट्विटर.कॉम/स्क्वहक्सग७याग","@witchybitchygal ""this earth is my meme"" @Atheist_Krishna picture : twitter.com/scVhuxg7YG","@विचीबिचीगल ""This Earth is my Meme"" @ एथीस्ट_कृष्णपिक.ट्विटर.कॉम/स्क्वहक्सग7याग"
@witchybitchygal hahahaa.. Supari ka zamana gaya.. Ab log sushi lete hai,@विचीबिचीगल हहहा.. सुपारी का जमाना गया.. अब लोग सुशी लेते है,@VichyBitchGal hahaha .. betel nut time gone .. now people take sushi,@विचीबिचीगल Haha.. the era of supari is gone.. now people take sushi.
"Aloha Kriti , what's the secret behind your beautiful Aakriti ?? #AskKriti @kritisanon","अलोहा कृति , व्हाट'एस थे सीक्रेट बिहाइंड यूर ब्यूटीफुल आकृति ?? #अस्कृति @कृतिसनों","aloha Kriti , what's the secret behind your beautiful shape ?? #AskKriti @kritisanon","Aloha Kriti, What's The Secret Behind Your Beautiful Look?? #अस्कृति @कृतिसनों"
@bhaiyyajispeaks haha.. Haath dho kar aana bhaiyya ji ,@भैय्याजिस्पीक्स हाहा.. हाथ धो कर आना भैय्या जी,) @Atheist_Krishna,@भैय्याजिस्पीक्स Haha.. wash your hands and come bhaiyya ji.
arianators please help me .i'm a girl who's body is very sore and just asking for ariana &amp,एरिएनेटर्स प्लीज हेल्प मे .आई'एम आ गर्ल व्हो'एस बॉडी इस वेरी सोरे एंड जस्ट आस्किंग फोर एरियाना &एएमपी, jennette's goodluck for tomorrow .please :(,Arianators please help me.I'm a girl who's body is very sore and just asking for Ariana & amp.
"income base pr quota  ?  ?  ?  ?  i thnk quota systm to hona hi ni chaiye  ,  students ko unki abilities ke base pr admission milna chaiye","इनकम बसे पीआर कोटा  ?  ?  ?  ?  आई ठंक कोटा सिस्टम तो होना ही नी चैये  ,  स्टूडेंट्स को उनकी एबिलिटीज के बसे पीआर एडमिशन मिलना चैये","quota based on income? i thnk quota system should not be there, students should get admission based on their abilities.","Income based PR Quota????? I think there should be a quota system, students should get PR admissions based on their abilities."
last years project churao dusting karo naya naam likho jama karo ache number pao ! ! aur haan ghar se project ke paise lena mat bhoolo ! ! !,लास्ट यर्स प्रोजेक्ट चुराओ डस्टिंग करो नया नाम लिखो जमा करो अचे नंबर पाओ ! ! और हाँ घर से प्रोजेक्ट के पैसे लेना मत भूलो ! ! !,last year's steal the project do dusting write a new name collect it get goo numbers !! and don't forget to get the project money from home.,"Steal the Last Years Project, do the dusting, write a new name, submit a new number!! And yes, don't forget to take the project money from home!!!"
"Hum to Aam Aadmi hain ji, woh Megalomaniac haipic.twitter.com/8KKhjRtSzQ","हम तो आम आदमी हैं जी, वोह मेगालोमैनियाक हैपिक.ट्विटर.कॉम/८ख्खजर्त्सज़्क","we are just common man, he is a Megalomaniac picture : twitter.com/8KKhjRtSzQ","We are common people, they are megalomaniacs हैपिक.ट्विटर.कॉम/8ख्खजर्त्सज़्क"
ye pm jhoontha hai .  .  .  kisi angle se honrable nahin hai .  .  .,ये पीम झूंठा है .  .  .  किसी एंगल से हॉनरेबल नहीं है .  .  ।,this pm is liar .  .  .  no way he is honorable .  .  .,This is a peem swing... not honourable from any angle...
@akshaykanitkar nahi bhai Gujarat@BabaBakChod,@अक्षयकानितकार नही भाई गुजरात@बाबाबकचोड़,"@akshaykanitkar no man, gujarat @BabaBakChod",@अक्षयकानितकार No Bhai Gujarat @बाबाबकचोड़
koi aur kaam dhandha nhi hai?kal monday hai :p,कोई और काम धंधा नही है?कल मंडे है :प,don't you have any other job? tommorow is monday,Isn't there any other business? Tomorrow is Monday: P
Mujhe dar lag raha hai.,मुझे दर लग रहा है।,i am feeling scary.,I feel the rate.
Keerthi ! lets open a NGO together ! toote dil ke marezon ke liyea,कीर्ति ! लेट्स ओपन आ न्गो टोगेदर ! टूटे दिल के मरेज़ों के लिया,Keerthi ! lets open a NGO together ! for the heartbroken patients.,Keerthi! Let's open and come together! Tukde Dil Ke Merejo Ke Liye
lagta h aap c offer mila h kya ?,लगता ह आप सी ऑफर मिला ह क्या ?,you seem to have received mutual offer?,Do you think you've got an offer?
bhavya solanki you'd love such schools than ours xd,भव्य सोलंकी यू'डी लव सुच स्कूल्स थान औरस एक्सडी,"Bhavya solanki, You would love such schools than that of ours",Bhavya Solanki U'D Love Such Schools Than Auras XD
":-D Woh bhi ek mein 5, ek-ek driver ke left aur right mein",":-डी वोह भी एक में ५, एक-एक ड्राइवर के लेफ्ट और राइट में",":-D That also five in one, one left to each driver and one to the right",": - D. Voh also 5 in one, one each to the left and right of the driver"
photos: rihanna crowned carnaval queen: pop superstar visited the greystone manor supperclub wednesday night and was .  .  .  http/URL,फोटोस: रिहाना क्राउंड कार्नावल क्वीन: पॉप सुपरस्टार विजिटेड थे ग्रेस्टोन मनोर सुपरक्लब वेडनेसडे नाइट एंड वास .  .  .  एचटीटीपी/उर्ल,photos: rihanna crowned carnaval queen: pop superstar visited the greystone manor supperclub wednesday night.,Photos: Rihanna Crowned Carnival Queen: The pop superstar visited Greystone Manor Superclub Wednesday Night and Was... HTTP / Url
those days .  .  . mario ki battakh pe uchal uchal ke khub life bnai mene,ठोसे डेज .  .  . मारियो की बत्तख पे उचल उचल के खूब लाइफ बनाई मेने,those days…I lived life by making mario’s duck jump,Thoose days... I made a lot of life by lifting Mario's duck.
#SamajwadiParty se #Gathbandhan to kar liya unhone ....,#समाजवादीपार्टी से #गठबंधन तो कर लिया उन्होंने ....,They made #SamajwadiParty in #Gathbandhan ....,#समाजवादीपार्टी to #गठबंधन so they did it....
10 number ke per mein 7 number ka joota ghusaya hai aisa lag raha hai.https://twitter.com/iPoonampandey/status/599596079781253120 …,१० नंबर के पेर में ७ नंबर का जूता घुसाया है एआईएसए लग रहा है.एचटीटीपीएस://ट्विटर.कॉम/इपूनामपांडे/स्टेटस/५९९५९६०७९७८१२५३१२० …,it looks like someone has  put a 10 sized shoe into their 7 sized feet .https://twitter.com/iPoonampandey/status/599596079781253120 …,No. 7 shoe has been inserted into the number 10 pair AISA looks है.एचटीटीपीएस: / / twitter.com / ipoonampande / status / 599596079781253120...
@friendlii_ghost Sarfaroshi ki tamanna ab hamare dil me hai,@फ्रेंडली_घोस्ट सरफरोशी की तमन्ना अब हमारे दिल मे है,@friendlii_ghost Sarfaroshi's wish is in our hearts now,@फ्रेंडली_घोस्ट Sarfaroshi's longing is now in our hearts
@zoomphatak audio kharab hai,@ज़ूमफटक ऑडियो खराब है,@zoomphatak audio is bad.,@ज़ूमफटक The audio is bad.
"@SrBachchan aap hamesha university ke bahar ke halat se rubaru karwate hain , university ke bheetar bhi Jana hota tha ?","@सरबच्चन आप हमेशा यूनिवर्सिटी के बाहर के हलत से रूबारू करवाते हैं , यूनिवर्सिटी के भीतर भी जाना होता था ?","@Sarbuchan You always get the situation outside the university, had to go inside the university too?","@सरबच्चन You always get a rub-off from the situation outside the university, had to go inside the university as well?"
@pillya @happlyunmarried satya vachhan!,@पिल्ल्या @हैप्ल्यूनमैरिड सत्य वच्चन!,@pillya @happlyunmarried satya vachhan!,@पिल्ल्या @हैप्ल्यूनमैरिड Satya Vachan!
@iamGunjanGrunge Bhai tu kaha hai bata.. Mein aa jata hu,@इयामगुंजांगरुंगे भाई टू कहा है बता.. में आ जाता हू,@iamGunjanGrunge bro tell me where are you.. i will come,"@इयामगुंजांगरुंगे Brother, tell me where you are. I will come."
"Hamein ek nek, sushil aur achhe gahr kki bahu chahiye.

*Hamara ladka chahe kitna bhi haramkhor ho*

#IndianFamilies","हमें एक नेक, सुशील और अछे गहर केकेआई बहु चाहिए.

*हमारा लड़का चाहे कितना भी हरामखोर हो*

#इंडियनफैमिलीज",we need a bride from a good family. *even though our son is useless* #Indian Families,"We want a good, decent and good looking KKI bahu. * No matter how much our boy is a haraamkhor * #इंडियनफैमिलीज"
@aniket51082 ye to yahi batayenge :) @bhuvanrajora,@अनिकेत५१०८२ ये तो यही बताएंगे :) @भुवनराजोरा,@aniket51082 only he will tell you that @bhuvanrajora,@अनिकेत51082 That's what they'll tell you:) @भुवनराजोरा
"going to 3mph: a woman's walk around the  .  .  .  at chautauqua community house on mon ,  nov 12 http/URL","गोइंग तो ३म्प: आ वुमन'एस वॉक अराउंड थे  .  .  .  एट चौतौका कम्युनिटी हाउस ओन मोन ,  नोव १२ एचटीटीपी/उर्ल","going to 3mph: a woman's walk around the  .  .  .  at chautauqua community house on mon ,  nov 12 http/URL","Going to 3pm: A woman's walk around was... at Chautauqua Community House on Mon, Nov 12 HTTP / Url"
MITRON.. Taj Mahal se mera puraana naata hai.. Mein apne grahako ko sirf Taj Mahal chai pilaata tha..https://twitter.com/ANI_news/status/800274552144019456 …,मित्रों.. ताज महल से मेरा पुराना नाता है.. में अपने ग्राहको को सिर्फ ताज महल चाई पिलाता था..एचटीटीपीएस://ट्विटर.कॉम/आनी_न्यूज/स्टेटस/८००२७४५५२१४४०१९४५६ …,Friends..  I have some old relation withTaj Mahal .. I only serve Taj Mahal tea to my customers..https://twitter.com/ANI_news/status/800274552144019456 …,Friends.. I have an old relationship with Taj Mahal.. I used to serve only Taj Mahal tea to my customers.. https: / / twitter.com / ani _ news / status / 800274552144019456...
salman aapne 3:30 bola tha,सलमान आपने ३:३० बोला था,salman you told about 3:30,"Salman, you said 3: 30."
.@JhaSanjay bhai tera bhi Vodafone ??,.@झसंजय भाई तेरा भी वोडाफोन ??,@JhaSanjay you also have vodafone ?,. @झसंजय Brother Tera also Vodafone??
@scaryhairyman lol maine kal kiya aur aaj repeat kiya,@स्केरीहेरीमैन लोल मैने कल किया और आज रिपीट किया,"@scaryhairyman laughing out loud, i did it yesterday and repeated today.",@स्केरीहेरीमैन lol I did it yesterday and I repeated it today.
acting nahi bas nautanki karwa lo is se .,एक्टिंग नही बस नौटंकी करवा लो इस से ।,make him do gimmick not acting.,"Don't act, just make a joke out of it."
bhai paka mat.. @TrollKejri Ka mukabla nahi kar paega tu @RoflGandhi_,भाई पका मत.. @ट्रोलकेजरी का मुकाबला नही कर पाएगा टू @रोफलगांधी_,brother don't make me bored. you won't able to compete with @TrollKejri  @RoflGandhi_,Brother don't cook.. won't be able to compete with @ट्रोलकेजरी to @रोफलगांधी_
agar woldcup jitna h na to ..sehwag aur yuvi ko bulale team me,अगर वोल्डकप जितना ह ना तो ..सहवाग और युवी को बुलाले टीम मे,"if you wan't to win the workcup, then can sehwag and yuvraj in the team.",If not as much as Woldkup.. call Sehwag and Yuvi in the team.
So #ArnabSlapsSagarika becomes #1 trend. Is desh ka kuchh nahi ho sakta.,सो #अर्नाबस्लाप्ससागरिका बिकम्स #१ ट्रेंड. इस देश का कुछ नही हो सकता।,so #ArnabSlapsSagarika becomes number 1 trending. this country is going nowhere.,So #अर्नाबस्लाप्ससागरिका becomes #1 trend. Nothing can happen to this country.
bkwas .  dhela ni jitna .,बकवास .  ढेला नी जितना ।,"rubbish, as much as new",Fucking shit.
.@ANI_news bhai thode achche camere khareed lo,.@आनी_न्यूज भाई थोड़े अच्छे कैमरे खरीद लो,@ANI_news you should purchase some better cameras brother.,Buy some good cameras. @आनी_न्यूज
@Punjaabi_Tadkaa ek thandi beer pee aur ek cigarette jala.. jeet chuke hain.,@पंजाबी_तड़का एक ठंडी बीर पी और एक सिगरेट जला.. जीत चुके हैं।,"@Punjaabi_Tadkaa have a cold beer and light a cigaratte, victory has been achieved",@पंजाबी_तड़का Drink a cold beer and light a cigarette.. have won.
"m sirf doordarsan hi dekhta hun us par bhi sirf pavitr bandhan ,  ,  , ","एम सिर्फ दूरदर्शन ही देखता हुन यूएस पर भी सिर्फ पवित्र बंधन ,  ,  ,","I only watch doordarshan, and also only pavitr bandhan on it","I only watch television, even in the US, only holy shit,"
@kachra_peti Mandira ko kuch mat bol be.. Tujhe thok dega aake @Fussy_Ca,@कचरा_पेटी मंदिरा को कुच मत बोल बे.. तुझे थोक देगा आके @फसी_सीए,@kachra_peti don't say anything to mandira.he will kill you. @Fussy_Ca,@कचरा_पेटी Don't talk down to Mandira..
RT @41deepak : After today's match : Anushka Sharma dumps Virat Kohli becoz she found another sharma #RohitSharma & she don't want to change,आरटी @४१दीपक : आफ्टर तोड़े'एस मैच : अनुष्का शर्मा डंप्स विराट कोहली बेकोज शे फाउंड अनोथेर शर्मा #रोहितशर्मा & शे दोन'टी वांट तो चंगे,RT @41deepak : after today's match : anushka sharma dumps virat kohli beausez she found another sharma #RohitSharma & she doesn't want to change.,RT @41दीपक: After todde's match: Anushka Sharma dumps Virat Kohli becoz she found another Sharma #रोहितशर्मा & she don't want to
mere toh aansu aa gaye ,मेरे तोह आंसू आ गये,(,I had tears in my eyes
Chhu ke bhag kachraaa chhu ke bhaaag.,छू के भाग कचरा छू के भाग।,touch and run garbage touch and run.,Parts of touch Parts of garbage touch.
RT @Sarcastic_Raj : @nexttosrk Allah tallah rahm kare ladko ne accha khela,आरटी @सरकास्टिक_राज : @नेक्स्टटोसर्क अल्ला तल्ला रहम करे लड़को ने अच्छ खेला,"RT @Sarcastic_Raj : @nexttosrk may allah and ram have mercy on us, boys played well",RT @सरकास्टिक_राज: @नेक्स्टटोसर्क Allah Talla Rahm Kare ladko gaya achcha khela
#DelhiPollution #delhiAirpollution #DelhiAirQuality Arvind Kejriwal ki Nayi Nautanki start ho gayi....shame on you Arvind ...pls jaag jao ab toh...Kyu life ke sath khilwaad ker rahe ho!!,#डेल्लीपोल्यूशन #डेल्हिएयरपोल्यूशन #डेल्हिएयरक्वालिटी अरविंद केजरीवाल की नयी नौटंकी स्टार्ट हो गयी....शेम ओन यू अरविंद ...पीएलएस जाग जाओ अब तोह...क्यू लाइफ के साथ खिलवाड़ केर रहे हो!!,"#DelhiPollution #delhiAirpollution #DelhiAirQuality Arvind Kejriwal started false drama, shame on you Arvind, please be aware you people, why are you playing with lives!",#डेल्लीपोल्यूशन #डेल्हिएयरपोल्यूशन #डेल्हिएयरक्वालिटी Arvind Kejriwal's new gimmick has started.... Shame on you Arvind... Pls wake up now you are messing with Q Life!!
baakiyo ke mummy daddy kahan gaye ?,बाकियों के मम्मी डैडी कहन गये ?,where are others’ parents?,Where did the rest of the moms and dads go?
@prtxt Usko pucha to woh kisi aur ka naam nahi batayega na? @BucketheadCase @rahulroushan,@पीआरटीएक्सटी उसको पूछा तो वोह किसी और का नाम नही बताएगा ना? @बकेटहेडकेस @राहुलरौशन,will he tell any other name upon asking asking him ?,"@पीआरटीएक्सटी He won't tell anyone else's name if you ask him, will he? @बकेटहेडकेस @राहुलरौशन"
i love u vaii.khuda hamesha apki saath rahegi vaii,आई लव उ वाई.खुदा हमेशा आपकी साथ रहेगी वाई,i love you vaii. the lord will always be with you vaii.,I love you वाई.खुदा will always be with you
#IndvsPak arre wo vaade ka kya hua ? kaha gayi ? Pak women's team to jeeti hi hai ! We are also waiting @QandeelQuebee,#इंडवस्पैक अर्रे वो वादे का क्या हुआ ? कहा गयी ? पाक वूमेन'एस टीम तो जीती ही है ! वे अरे अलसो वेटिंग @क़ंदीलकेबी,"#IndvsPak oh, waht happened to that promise? where it went? pakistan women's team already won!  we are also waiting @QandeelQuebee",#इंडवस्पैक Arre what happened to that promise? It was said. The Pak Women's team has won! They are waiting for you. @क़ंदीलकेबी
