hinglish,hinglish_dev,english,english_pred
@MeetUunngLee bhai block kar do unko!,@मीटूँगली भाई ब्लॉक कर दो उनको!,@MeetUunngLee bro block them!,"@मीटूँगली Brother, block them!"
"""AAP jaisa koi mere zindagi mein aaye toh jhand ho jaaye"" - Delhi Chaps","""आप जैसा कोई मेरे जिंदगी में आये तोह झंड हो जाए"" - डेल्ही चैप्स","""if someone like you comes in my life, then my life becomes complicated -delhi chaps","""Somebody like you should come into my life."" - Delhi Chaps"
Holi hai bhai Holi hai India ka captain #Kohli hai #HappyHoli everyone @imVkohli @BCCI,होली है भाई होली है इंडिया का कैप्टन #कोहली है #हैपीहोली एवरयोन @इम्वकोहली @बीसीसीआई,it's holi! india's captain is #Kohli. #HappyHoli everyone @imVkohli @BCCI,Holi hai bhai Holi hai India ka captain is #कोहली #हैपीहोली Everon @इम्वकोहली @बीसीसीआई
ind world jitegi hi nhi khushi kanha milegi .  .  .  .  .  .  .  .,इंड वर्ल्ड जीतेगी ही नही खुशी कन्हा मिलेगी .  .  .  .  .  .  .  ।,"india will not win world 'cup ', how to get happy.","India will not only win the world, it will also win happiness."
"download hogi , toh fake toh ho hi nahi sakti","डाउनलोड होगी , तोह फेक तोह हो ही नही सकती",it will get downloaded. so there is no chance of it being fake,"will be downloaded, you can't be fake."
who would go see @someUSER with me at dar constitution hall on sunday evening ?,व्हो वोल्ड गो सी @सोम्यूजर विथ मे एट दर कांस्टीट्यूशन हाल ओन संडे इवनिंग ?,who would go see @someUSER with me at there constitution hall on sunday evening ?,Who Wold Go See @सोम्यूजर with May at the Constitution Hall on Sunday Evening?
@GappistanRadio haan ee jhol lag raha hai,@गप्पिस्तानरेडियो हाँ ई झोल लग रहा है,@GappistanRadio yes it looks like a fraud,"@गप्पिस्तानरेडियो Yes, it seems to be jammed."
"@KameeniChhori har chiz paisa nahi hoti simran, kuchh pyar bhi hota hai.","@कमीनीछोरी हर चीज पैसा नही होती सिमरन, कुछ प्यार भी होता है।","@KameeniChhori not everything is money simran, some love is also there","@कमीनीछोरी Everything is not money Simran, there is also some love."
Gurdeep Singh khushi se phule nahi samaaye.pic.twitter.com/MZrSabJjQ2,गुरदीप सिंह खुशी से फुले नही समाये.पिक.ट्विटर.कॉम/मज़रसबज्ज़क२,gurdeep singh seems to be very happy pic.twitter.com/MZrSabJjQ2,Gurdeep Singh not blossoming with joy समाये.पिक.ट्विटर.कॉम/मज़रसबज्ज़क2
I like Gurgaon.. Ladkiya mast hai waha ki,आई लाइक गुड़गांव.. लड़किया मस्त है वहा की,I like Gurgaon... there are nice girls there.,I like Gurgaon.. girls are cool there.
"indian ki batting 'rang de basanti' movie ki tarah thi ,  sabne accha perform kiya par end me sab mar gaye .  .  .  . ","इंडियन की बैटिंग 'रंग दे बसंती' मूवी की तरह थी ,  सबने अच्छ परफॉर्म किया पर एंड मे सब मार गये .  .  .  ।","india's batting was like a 'rang de basanti' movie, everyone performed well but everyone died in the end. . . .
","Indian's batting was like a'Rang De Basanti'movie, everyone performed well but in the end, everyone died."
@witchybitchygal Haha. Phir to woh Gul hi ho jayega,@विचीबिचीगल हाहा. फिर तो वोह गुल ही हो जाएगा,@witchybitchygal haha. then it will turn.,@विचीबिचीगल Haha. Then it'll just disappear.
"@someUSER haha ! ! well keep going , my hubby gave up on ash wed in '96 &amp; has never looked back . ","@सोम्यूजर हाहा ! ! वेल कीप गोइंग , माई हबी गेव उप ओन अश वेद इन '९६ &एएमपी; हास नेवर लुक्ड बैक ।","@someUSER haha ! ! well keep going , my hubby gave up on ash wed in '96 and has never looked back . ","@सोम्यूजर Haha!! Well keep going, my hubby gave up on Ash Ved in'96 & amp; has never looked back."
"She: Baadlon mein chhup raha hai chaand kyu?
He: Dimaag mat kha sone de.
#HeSheStories","शे: बादलों में छुप रहा है चांद क्यू?
हे: दिमाग मत खा सोने दे.
#हेशेस्टोरीज","She: wht is the moon hiding in the clouds?
He: don't irritate me. let me sleep.
#HeSheStories",Shay: Why is the moon hiding in the clouds? Hey: Don't let your mind go to sleep. #हेशेस्टोरीज
@KajuBadamChor khatti meethi nahi hai yeh. Hum log kampat bolte the,@काजूबदमचोर खट्टी मीठी नही है येह. हम लोग कम्पट बोलते थे,@KajuBadamChor this isn't sweet or sour. we speak kampat.,@काजूबदमचोर Sour isn't sweet. We used to say compot.
"guddu k pillow b smile kr re ,  guddu ki tarah !  ! ","गुड्डू के पिलो बी स्माइल केआर रे ,  गुड्डू की तरह !  !","Guddu's pillows are smiling, just like guddu! ","Guddu ke pillow b smile KR re, like Guddu!!"
"bichara udhbilao chips laya tha usse bel diya ,  khana lane wale ko kbhi nhi marte :p","बिचारा उधबिलाओ चिप्स लाया था उस्से बेल दिया ,  खाना लाने वाले को कभी नही मारते :प","the poor udhbilao brought us chips and we beat him, don't beat the one who brings food.","Poor kid brought chips, gave us bail, never hit the foodie: -P"
@Rofl_Delhite MI ne bahut chitting kiya hai,@रोफल_डेलहाइट मी ने बहुत चिटिंग किया है,@Rofl_Delhite mi has cheated a lot,@रोफल_डेलहाइट I have done a lot of cheating.
"Jaijinendra , 07412-235423 DT 28-2-2016 se band hai Pl chalu karva deve him bahut pareshan hai No "" 9406636779 Thanks #RaviShankarPrasad","जयजिनेन्द्र , ०७४१२-२३५४२३ दत २८-२-२०१६ से बंद है पीएल चालू करवा देवे हिम बहुत परेशन है नो "" ९४०६६३६७७९ थैंक्स #रविशंकरप्रसाद","jaijinendra, 07412-235423 dt is closed from 28-2-2016 please open it , he is very upset no -9406636779 thanks #RaviShankarPrasad ","Jaijinendra, 07412-235423 Dutt is off 28-2-2016 Get the PL on let him have a lot of pareshan no ""9406636779 Thanks #रविशंकरप्रसाद"
i totaly agree with the post  .  .  teachers have no right to spoil students carrer now  .  .  .  .,आई टोटली एग्री विथ थे पोस्ट  .  .  टीचर्स हेव नो राइट तो स्पॉइल स्टूडेंट्स कैरर नौ  .  .  .  ।,i totally agree with the post .teachers have no right to spoil students career now . ,I'm totally angry with the post... teachers have no right to spoil students'careers...
@SritikaDhar ye sense nahi bana,@श्रीतिकाधार ये सेंस नही बना,@SritikaDhar this doesn't make sense,@श्रीतिकाधार Didn't make sense
".@i_fattimaayyy main toh tumhare pyaar mein gum hogaya hu DP dekh kar, baaki deshwale match dekh rahe hai.",".@आई_फत्तीमाय्य मैं तोह तुम्हारे प्यार में गुम होगया हू डीपी देख कर, बाकी देशवाले मैच देख रहे है।",@i_fattimaayyy  i’m lost in your love after seeing your display picture. other countrymen are watching match.,". @आई_फत्तीमाय्य I'm so lost in your love, watching the DP, the rest of the country is watching the match."
wide wali eent to sirf deekhane ke liye hoti thi .  .,वाइड वाली ईंट तो सिर्फ दीखने के लिए होती थी .  ।,wide brick is used only for displaying. .,The wide brick was just for show.
@UrbanZameendar Govinda ka humshakal bhi,@उर्बनज़मींदर गोविंदा का हमशकल भी,@UrbanZameendar govinda's doppleganger too.,@उर्बनज़मींदर Govinda's lookalike too
Find this cute puppy a home? yahan khud ke kiraaye ke paise nahi hai.,फाइंड थिस क्यूट पप्पी आ होम? यहां खुद के किराए के पैसे नही है।,Find this cute puppy a home? there is no money for (my/our)  own rent.,Find this cute puppy at home? There's no money for rent here.
idiot advertisment shame on .  .,इडियट एडवर्टिजमेंट शेम ओन .  ।,shame on idiot advertisment,Idiot Advertisement Shame on.
"RT @ashutosh83B : Murderous assault on AAP MLA , Kartar Singh Tanwar . Chhatarpur . Driver is injured . Attackers were carrying pistol . Kartar i","आरटी @आशुतोष८३बी : मर्डर असॉल्ट ओन आप मला , करतार सिंह तंवर . छतरपुर . ड्राइवर इस इंजर्ड . अटैकर्स वेरे कैरिंग पिस्तोल . करतार आई","retweet @ashutosh83B : murderous assault on AAP MLA , kartar singh tanwar . chhatarpur . driver is injured . attackers were carrying pistol . Kartar i","RT @आशुतोष83बी: Murder Assault on Aap Mala, Kartar Singh Tanwar. Chhatarpur. Driver is injured. Attackers wear carrying pistols. Kartar I"
#WhereIsRahul is trending No 1 on twitter worldwide . Common Rahul ab toh aa zao . Tumhe 191 mulko ke log dhoondh rahe hain,#व्हेरेइसराहुल इस ट्रेंडिंग नो १ ओन ट्विटर वर्ल्डवाइड . कॉमन राहुल अब तोह आ ज़ाओ . तुम्हे १९१ मुल्को के लोग ढूंढ रहे हैं,"#WhereIsRahul is trending No 1 on twitter worldwide . come on rahul, at least come now. people from 191 regions are looking for you.",#व्हेरेइसराहुल This is trending no1 on Twitter worldwide. Common Rahul now you come. You are being searched by people from 191 countries.
RT @zoomphatak : Shakira- hello .. Subramanium Swami hai ? Servant- saab Africa gaye hai Shakira- Swami na mila .. e e e .. waka waka .. e e e .. he '''',आरटी @ज़ूमफटक : शकीरा- हेलो .. सुब्रमण्यम स्वामी है ? सर्वेंट- साब अफ्रीका गये है शकीरा- स्वामी ना मिला .. ई ई ई .. वाका वाका .. ई ई ई .. हे '''',retweet @zoomphatak : shakira- hello is subramanium swami there? servant- he went to africa shakira- swami we did not get swami wakka wakka he he,"RT @ज़ूमफटक: Shakira - Hello... is Subramaniam Swamy? Servant-saab has gone to Africa. Shakira-swamy na mila... ee ee... waka waka... ee ee.. """
"Tu paisa paisa karti hai.. Kyu paise pe tu marti hai
 
 #NitishLaluStingpic.twitter.com/QnJc0Hw4G7","टू पैसा पैसा करती है.. क्यू पैसे पे टू मारती है
 
 #निटिशलालस्टिंगपिक.ट्विटर.कॉम/क्यूएनजेसी०ह्व४जी७","you are keep talking about money, why money matters to you so much?
 
 #NitishLaluSting picture : twitter.com/QnJc0Hw4G7",To paisa paisa karti hai.. Kyun paisa pay to maarti hai # निटिशलालस्टिंगपिक.ट्विटर.कॉम/क्यूएनजेसी0ह्व4जी7
@RoflGandhi_ unka intezar karna bhi bekar hai bhai!,@रोफलगांधी_ उनका इंतजार करना भी बेकर है भाई!,@RoflGandhi_ waitiing for them is also waste!,@रोफलगांधी_ Waiting for them is also a baker brother!
@LoKarloUnfollow jaane nahi denge tujhe.....,@लोकार्लोउनफोलो जाने नही देंगे तुझे.....,@LoKarloUnfollow We won't let you go.,@लोकार्लोउनफोलो won't let you go....
"Intolerance nahi badha hai, attention paane ki hawas badhi hai.","इंटॉलरेंस नही बढ़ा है, अटेंशन पाने की हवास बढ़ी है।","Intolerance hasn't increased, hunger for attention has increased.","Intolerance has not increased, the urge to get attention has increased."
@Atheist_Krishna woh sab Ooooollluuu k phatte haipic.twitter.com/exQh4VPAen,@एथीस्ट_कृष्ण वोह सब ऊओउल्लू के फट्टे हैपिक.ट्विटर.कॉम/एक्सक४वीपीएन,@Atheist_Krishna they are all fools pic.twitter.com/exQh4VPAen,@एथीस्ट_कृष्ण All of them are Ooooooooooooooooooooooooooooooooooooooooooooooooooooooooooooooooooooooooooooooooooooooooooooooooooooooooooooooooooooooooooooooooooooooooooooooooooooooooooooooooooooooooooooooooooooooooooooooooooooooooooooooooooooooooooooooooooooooooooooooooooooooooooooooooooooooooooooooooooooooooooooooooooooooooooooooooooooooooooooooooooooooooooooooooooooooooooooooooooooooooooooooooooooooooooooooooooooooooooooooooooooooooooooooooooooooooooooooooooooooooooooooooooooooooooooooooooooooooooooooooooooooooooooo
"@krazyfrog ""khelne ke liye toh sabhi khiladi aate hain, jeetne ke liye ek""","@क्रेजीफ्रॉग ""खेलने के लिए तोह सभी खिलाडी आते हैं, जीतने के लिए एक""","@krazyfrog ""all players come for playing, only one for winning""","@क्रेजीफ्रॉग ""All players come to play, one to win"""
@indiantweeter @Paytm kya kiya inhone ab,@इंडियंटवीटर @पेटीएम क्या किया इन्होने अब,@Indiantweeter @Paytm what did they do now,@इंडियंटवीटर @पेटीएम What did they do now?
@clued_up_chic mind ganda hona chahiye.. Saaf to tijori bhi hoti hai ,@क्लूड_उप_चिक माइंड गंदा होना चाहिए.. साफ तो तिजोरी भी होती है,),@क्लूड_उप_चिक Mind should be dirty..
Item set hui ki nahi?https://twitter.com/UberFacts/status/634780090237341696 …,इतेम सेट हुई की नही?एचटीटीपीएस://ट्विटर.कॉम/अबरफैक्ट्स/स्टेटस/६३४७८००९०२३७३४१६९६ …,did you got that girl? https://twitter.com/UberFacts/status/634780090237341696,Is it set or not? http: / / twitter.com / AberFacts / status / 634780090237341696...
u cant blame me.. meri shaadi ho gayee,उ कैंट ब्लेम मे.. मेरी शादी हो गयी,you can’t blame me. i’m already married.,Uhhhhhhhhhhhhhhhhhhhhhhhhhhhhhhhhhhhhhhhhhhhhhhhhhhhhhhhhhhhhhhhhhhhhhhhhhhhhhhhhhhhhhhhhhhhhhhhhhhhhhhhhhhhhhhhhhhhhhhhhhhhhhhhhhhhhhhhhhhhhhhhhhhhhhhhhhhhhhhhhhhhhhhhhhhhhhhhhhhhhhhhhhhhhhhhhhhhhhhhhhhhhhhhhhhhhhhhhhhhhhhhhhhhhhhhhhhhhhhhhhhhhhhhhhhhhhh
duniya gayi tel lene .  .  apne khaane peene mein busy ,दुनिया गयी टेल लेने .  .  अपने खाने पीने में बसी,),The world went to get the tail... settled into its food and drink
Shikhar Dhawan ne bhi 50 run jod diye. Ab bhi nahi jeete to kal tak wapas aa jana.,शिखर धवन ने भी ५० रन जोड़ दिये. अब भी नही जीते तो कल तक वापस आ जाना।,even shikhar dhawan scored a 50 . if you guys still don't win then come back by tomorrow.,"Shikhar Dhawan also added 50 runs. If you still don't win, come back by tomorrow."
aur phir proof bhi deta.. dekho Mehr ka ration card..,और फिर प्रूफ भी देता.. देखो मेहर का रेशन कार्ड..,"And then I gave proof too, now see my ration card! ",And then he would also give the proof.. Look at Meher's ration card..
"@The_Lie_Lama As in abhi Tiger baaghi nahi, woh thak gayi hai?","@थे_लिए_लामा एएस इन अभी टाइगर बाघी नही, वोह थक गयी है?","@The_Lie_Lama As in the Tiger has not run away, it is tired?","@थे_लिए_लामा AS in It's not Tiger yet, she's tired?"
Idoit...salman aap muslim hai...Aisa faission show kyon karwaya..allah likkar,इदोइत...सलमान आप मुस्लिम है...एआईएसए फैशन शो क्यों करवाया..अल्ला लिक्कर,"idiot, salman you are a muslim. why do you show this kind of fashion.",Idoit... Salman you are a Muslim... Why AISA fashion show?
@Champ_Nikk thodi si jo pee li hai,@चैंप_निक्क थोड़ी सी जो पी ली है,@Champ_Nikk i have drunk some liquor.,@चैंप_निक्क A little bit of what has been drunk
kuch bhi ho sakta hai :),कुच भी हो सकता है :),anything can happen ,It could also be a bug:)
Aaj tak ye Bangladeshi uss run out ka badl le raha hai mujhse.https://twitter.com/Realbangladeshi/status/806715786991648770 …,आज तक ये बांग्लादेशी यूएस रन आउट का बदल ले रहा है मुझसे.एचटीटीपीएस://ट्विटर.कॉम/रियलबांग्लादेशी/स्टेटस/८०६७१५७८६९९१६४८७७० …,bangladeshis are still taking revenge fof that run out from me.https://twitter.com/Realbangladeshi/status/806715786991648770 …,"As of today, this Bangladeshi is taking revenge for the US run out मुझसे.एचटीटीपीएस: / / Twitter.com / RealBangladeshi / Status / 806715786991648770..."
@Indian_Azzurri Bahut maroonga. Rashi bhi,@इंडियन_अज्जुर्री बहुत मरूंगा. राशी भी,@Indian_Azzurri will beat you hard. rashi also,@इंडियन_अज्जुर्री I'll die a lot. Rashi too
"Doosro ka maar ke bana thaa, doosro ka maarne ke chakkar me phasa....","दूसरों का मार के बना था, दूसरों का मारने के चक्कर मे फसा....","got the name by beating others, got trapped because of others'","Others were killed, others were killed."
@raviishndtv or modiji ye kaam acche se kr lete h ...,@रविष्णदत्व ओर मोदीजी ये काम अच्छे से केआर लेते ह ...,@raviishndtv or modiji do this type of work better ...,@रविष्णदत्व And Modiji takes this job well KR...
"first 24 hours in london got given a free rail card ,saw 3 squirrels going to work ,may have found a home &amp; there's big alan rickman posters","फर्स्ट २४ हॉर्स इन लंडन गोट गिवेन आ फ्री रेल कार्ड ,साव ३ स्क्विरल्स गोइंग तो वर्क ,मे हेव फाउंड आ होम &एएमपी; थेरे'एस बिग अलान रिकमैन पोस्टर्स","first 24 hours in london: was given a free rail card, saw 3 squirrels going to work ,may have found a home and there's big alan rickman posters","First 24 Hours in London Got Given and Free Railcards, Saw 3 Squirrels Going to Work, May Have Found a Home & amp; There's Big Alan Rickman Posters"
"pehle kuch banke dikhavo bacchon "" Kashmir issue tho tumhare bina bhi solve ho jayega #DU #JNU #antinationals #AzadiBrigade","पहले कुच बांके दिखावो बच्चों "" कश्मीर इश्यू थो तुम्हारे बिना भी सॉल्व हो जाएगा #डू #जेएनयू #एंटीनेशनल्स #अजाडिब्रिगेड",first become something children Kashmir issue can also be solved without you #DU #JNU #antinationals #AzadiBrigade,"Show me the first thing kids ""Kashmir issue will be solved even without you #डू #जेएनयू #एंटीनेशनल्स #अजाडिब्रिगेड"
Hmare bina tera koi wajood nhi #salman ...sale pathano k nam p kalank h tu,हमारे बिना तेरा कोई वजूद नही #सलमान ...साले पठानों के नाम प कलंक ह टू,you are nothing without us #salman.. you are a blur in the name of pathan,You don't exist without us #सलमान...
""" @sonalSalmanK : SA this time India didn't waste opportunity . Chauka bhi laga aur mauka bhi le kiya #IndvsSA """,""" @सोनलसलमांक : सा थिस टाइम इंडिया दिदन'टी वास्ते अपॉर्च्युनिटी . चौका भी लगा और मौका भी ले किया #इंडवासा ""","@SonalSalamanandak: sa this time india for the day. opportunity. it took a chowk and took the opportunity #indwassa""","""@सोनलसलमांक: This Time India Didn't Give Up Opportunity. Got Bumped and Took a Chance #इंडवासा"" """""
"@Humor_Donor nahin yaar, aise kaise? :D","@ह्यूमर_डोनर नहीं यार, एआईएसई कैसे? :डी","@Humor_Donor no friend, how come?","@ह्यूमर_डोनर No man, how about AISE?: D"
ghost rider 2's a bad movie compared to the 1st .,घोस्ट राइडर २'एस आ बाद मूवी कंपेयर्ड तो थे १एसटी ।,ghost rider 2's a bad movie compared to the 1st .,Ghost Rider 2's and later movie compares were 1ST.
@rootofall3vil @BCCI dekho kahin pyaar na ho jaye,@रूटोफॉल३विल @बीसीसीआई देखो कहीं प्यार ना हो जाए,@rootofall3vil @BCCI carful with falling in love with someone,@रूटोफॉल3विल @बीसीसीआई See Where Love Goes Wrong
"i might go to pierce the veil at northern lights (sold out) in albany ,  ny - oct 31 http/URL","आई माइट गो तो पियर्स थे वेल एट नॉर्दर्न लाइट्स (सोल्ड आउट) इन अल्बानी ,  नी - ओसीटी ३१ एचटीटीपी/उर्ल","i might go to pierce the veil at northern lights (sold out) in albany ,  new york - 31 october","I Might Go So Pears were Well at Northern Lights (Sold Out) in Albany, NY - OCT 31 HTTP / Url"
"Kiska bhaijan kahan ka Bhai jaan Kutte tu ek nambar shetan,,,, Eed me hi aata he,, kharab karne imman,,,","किसका भाईजान कहन का भाई जान कुत्ते टू एक नंबर शेतान,,,, ईड मे ही आता हे,, खराब करने इमान,,,","whom friend, what friend, you are a devil, you only come on eid, to remove everyone's faith","Kiska bhaijaan kahan ka bhaijaan kutte to ek number shaitaan,,,,, id mein hi aata hai,,,,,,,"
Relatives to me - beta insaan ho ya #ManmohanSingh kabhi kuch bolte hi nahi,रिलेटिव्स तो मे - बेटा इंसान हो या #मनमोहनसिंह कभी कुच बोलते ही नही,"relatives to me - son, are you human or #ManmohanSingh? you never speak anything.",Relatives are either me-beta human beings or #मनमोहनसिंह never speak badly.
nazdeek kahin hota to khud mangwa leta!,नजदीक कहीं होता तो खुद मंगवा लेता!,if i would have been near then i would have ordered myself,"If you were anywhere near, you'd have to order it yourself!"
"""Sue ji hain kya?"" - Aamir Khan in Rang de Basanti","""सुए जी हैं क्या?"" - आमिर खान इन रंग दे बसंती","""is Sue there?"" - Aamir Khan in Rang de Basanti","""Suye ji hain kya?"" - Aamir Khan in Rang De Basanti"
to muslim kaun ka iss desh se pyaar karte hai @masala_chaas @yogi_adityanath @Support,तो मुस्लिम कौन का आईएस देश से प्यार करते है @मसाला_चास @योगी_आदित्यनाथ @सपोर्ट,which muslim loves this country @masala_chaas @yogi_adityanath @Support,So which IS country do Muslims love @मसाला_चास @योगी_आदित्यनाथ @सपोर्ट
