hinglish,hinglish_dev,english,english_pred
1st time i've seen eleanor respond to hate o . o she seems to sweet to say 1 mean thing !  http/URL,१एसटी टाइम आई'वे सीन एलिनोर रिस्पॉन्ड तो हटे ओ . ओ शे सीम्स तो स्वीट तो से १ मीन थिंग !  एचटीटीपी/उर्ल,it’s the first time i’ve seen eleanor respond to hate. she is sweet and doesn’t say mean things! http/URL,1ST TIME I'VE SEEN ELINOR RESPOND TO HATE OH SHE SEAMS TOH SWEET TOH 1 MEAN THING! HTTP / Url
"Haan,  Sab Modiji ki galati hai","हाँ,  सब मोदीजी की गलती है","yes, sir it is modiji's fault","Yes, it is all Modiji's fault."
"Aaj ye pagli @RanaAyyub deewanon ki tarah naachegi
http://www.dnaindia.com/india/report-by-2050-india-will-have-largest-muslim-population-pew-2340867 …","आज ये पगली @रनाय्यूब दीवानों की तरह नाचेगी
एचटीटीपी://डब्ल्यूडब्ल्यूडब्ल्यूडब्ल्यूडब्यूडब्ल्यूडब्यूडब्यूडब्यूडब्ल्यूडब्ल्यूडब्यूडब्ल्ल्यूडब्यूडब्ल्यूडब्यूडब्ल्यूडब्ल्यूडब्ल्यूडब्ल्ल्यूडब्यूडब्यूडब्ल्यूडब्यूडब्यूडब्यूडब्ल्यूडब्ल्यूडब्यूडब्यूडब्यूडब्यूडब्ल.दनैंदिया.कॉम/इंडिया/रिपोर्ट-बी-२०५०-इंडिया-विल-हेव-लार्जेस्ट-मुस्लिम-पॉपुलेशन-पेव-२३४०८६७ …",today this fool @RanaAyyub will dance like possessed. http://www.dnaindia.com/india/report-by-2050-india-will-have-largest-muslim-population-pew-2340867 …,"Today, this pagli will dance like divans. https: / / www.wwwwwwwwwwwwwwwwwwww.dnaindia.com / india / report-b-2050-india-will-have-largest-muslim-population-pave-2340867..."
Hai na? Paap chadhega,है ना? पाप चढ़ेगा,i know right? a sinner.,Isn't it? Sin will rise.
"Umr nikalti jarahi hai tumhari, dekho woh pados wale Imran ne teen baar shaadi kar li. AUR TUM?https://twitter.com/DunyaNews/status/752783713948274689 …","उम्र निकलती जरही है तुम्हारी, देखो वोह पड़ोस वाले इमरान ने तीन बार शादी कर ली. और तुम?एचटीटीपीएस://ट्विटर.कॉम/डन्यान्यूज/स्टेटस/७५२७८३७१३९४८२७४६८९ …",you are ageing. see that imran has done three marriages. and you? https://twitter.com/DunyaNews/status/752783713948274689,"Your age is coming out, see that neighbour Imran got married three times. And you?"
tell her to be ur frnd first make ur frndship strong  !  !  best of luck  !  !,टेल हेर तो बे उर फ्रेंड फर्स्ट मेक उर फ्रेंडशिप स्ट्रांग  !  !  बेस्ट ओएफ लक  !  !,tell her to be your friend first make your friendship strong ! ! best of luck ! !,Tell Her to Be Your Friend First Make Your Friendship Strong!! Best OF Luck!!
Iss mein Modiji ka haath hai jihttps://twitter.com/ArvindKejriwal/status/803502373180088321 …,आईएस में मोदीजी का हाथ है जिहत्तप्स://ट्विटर.कॉम/अरविंदकेजरीवाल/स्टेटस/८०३५०२३७३१८००८८३२१ …,modi is behind this https://twitter.com/ArvindKejriwal/status/803502373180088321 ,Modiji's hand in IS is Jihattups: / / Twitter.com / ArvindKejriwal / Status / 803502373180088321...
@journojuno sabhyata kahan hai? Kahan hai sabhyata?,@जर्नोजुनो सभ्यता कहन है? कहन है सभ्यता?,@journojuno where is decency? where is decency?,What is civilization? What is civilization?
"^^^ and also, Salman bhai ka saat samandar paar dance from Kick. Bhai ki baat hi niraali hai.","^^^ एंड अलसो, सलमान भाई का सात समंदर पार डांस फ्रॉम किक. भाई की बात ही निराली है।","and also, salman brother's beyond the seven seas dance from kick. brother is amazing","^ ^ ^ ^ And finally, Salman bhai ka saat samundar paar dance from Kick. Bhai ki baat hi nirali hai."
"omg ,  bullet for my valentine are coming to the netherlands march 21th .  i might attend that one too :p","ओएमजी ,  बुलेट फोर माई वैलेंटाइन अरे कमिंग तो थे नेदरलैंड्स मार्च २१थ .  आई माइट अटेंड थाट ओने टू :प","omg ,  bullet for my valentine are coming to the netherlands march 21th .  i might attend that one too","OMG, Bullet for My Valentine is Coming to the Netherlands March 21st. I Might Attend That One Too"
"Reemand par jaate hue mobile phone haath https://t.co/N0ugIBktO4 virender singh , ise khete hai sarkar se setting . https://t.co/fET4hxZHcw","रीमांड पर जाते हुए मोबाइल फोन हाथ एचटीटीपीएस://टी.सीओ/न०उगिबक्तो४ वीरेंद्र सिंह , इसे खेते है सरकार से सेटिंग . एचटीटीपीएस://टी.सीओ/फेट४एचएक्सजेएचसीडब्लू","Mobile phone handheld while going on remand: http://t.co./jugibkto4 Virender Singh, this is called the setting from Circar. Http: //T.CO/Fet4Haszhaku","Mobile phone hand while going to Remand HTTPS: / / t.co / NoGbKo4Virendra Singh, eat it Settings from Government. HTTPS: / / t.co / Fet4HXJHCW"
To bhai cheating kyu kiya.. Sahi raasta apnate to ye naubat nahi aatihttps://twitter.com/dna/status/623545670452903936 …,तो भाई चीटिंग क्यू किया.. सही रास्ता अपनाते तो ये नौबत नही आतिहत्त्प्स://ट्विटर.कॉम/दाना/स्टेटस/६२३५४५६७०४५२९०३९३६ …,brother why did you cheat.. there would have been no problems if you had taken the proper path. https://twitter.com/dna/status/623545670452903936 …,"So why did bhai cheat.. if he takes the right path, it won't matter: / / twitter.com / Dana / status / 623545670452903936..."
@someUSER @someUSER at least there is hope coming around february .  i'm looking at a team where jr smith is the x-factor .,@सोम्यूजर @सोम्यूजर एट लीस्ट थेरे इस होप कमिंग अराउंड फेब्रुअरी .  आई'एम लुकिंग एट आ टीम व्हेयर जेआर स्मिथ इस थे क्स-फैक्टर ।,@someUSER @someUSER at least there is hope coming around february .  i'm looking at a team where junior smith is the x-factor .,@सोम्यूजर @सोम्यूजर At Least There's Hope Coming Around February. I'm Looking At and Team Where JR Smith Was The X-Factor.
"salman bhaijan,....se baat krne hai,...bass ye bolna hai ur moive will superhit.....","सलमान भाईजान,....से बात करने है,...बस ये बोलना है उर मोइवे विल सुपरहिट.....","want to talk to salman brother,just want to say that your movie will be superhit.","Salman Bhaijaan,.... se baat karne hai,... bas yeh bolna hai ur moi will be superhit...."
@twinitisha kab reply nahi kiya tumhe?,@ट्विनिटिशा कब रिप्लाई नही किया तुम्हे?,@Twenitisha when did you not reply?,@ट्विनिटिशा When did you not reply?
"Kejriwal ka toh chotta se sambandh hai
Vote now https://twitter.com/AdvancedMaushi/status/676338966623223808 …pic.twitter.com/aOtta601nJ","केजरीवाल का तोह चोट्टा से संबंध है
वोट नौ एचटीटीपीएस://ट्विटर.कॉम/एडवांस्डमौशी/स्टेटस/६७६३३८९६६६२३२२३८०८ …पिक.ट्विटर.कॉम/ओट्टा६०१नज",kejriwal has only a small relationship. vote now https://twitter.com/AdvancedMaushi/status/676338966623223808 …pic.twitter.com/aOtta601nJ,Kejriwal is related to Toh Chotta VoteNow HTTPS: / / twitter.com / advancemaushi / status / 676338966623223808... पिक.ट्विटर.कॉम/ओट्टा601नज
Talk time nai saheb data speed chaiye ..,तल्क टाइम नई साहेब डाटा स्पीड चैये ..,sir i don’t want talk time but data speed,Talk time new sahib data speed chaiye..
@JatinKiDuniya @GodrejExpert vo mujhe chocolate dete hai#MyFirstHero,@जातिंकीदुनिया @गोड्रेजेक्सपर्ट वो मुझे चॉकलेट देते है#माइफर्स्थेरो,@Jatinkiduniya @godrejexpert they give me chocolate #mafirsthero,@जातिंकीदुनिया @गोड्रेजेक्सपर्ट He gives me chocolate #माइफर्स्थेरो
@Atheist_Krishna jis mein tune ek photo daali hai?,@एथीस्ट_कृष्ण जिस में ट्यून एक फोटो डाली है?,@Atheist_Krishna the one in which you put a photo?,@एथीस्ट_कृष्ण To which Tune has inserted a photo?
@EngineeRoholic thanks bhai :),@इंजिनियरोहोलिक थैंक्स भाई :),@EngineeRoholic thanks brother.,@इंजिनियरोहोलिक Thank you brother:)
@krazyfrog teri beti pepsi piti hai ladkon ke saath,@क्रेजीफ्रॉग तेरी बेटी पेप्सी पीती है लड़कों के साथ,@Crazyfrog your daughter Pepsi drinks with boys,@क्रेजीफ्रॉग Your daughter drinks Pepsi with the boys.
"haha, biwi se bachakar bhai, tu hospital se tweet karein ye mujhe bilkul gawara nahi","हाहा, बीवी से बचाकर भाई, टू हॉस्पिटल से ट्वीट करें ये मुझे बिल्कुल गवारा नही","haha, stay away from your wife, you tweet from hospital this not accepted by me","Haha, save me from the wife, brother, tweet from the hospital, it doesn't bother me at all."
"@Gurmeetramrahim #BlockBusterMSG PitaJi , Aap Ko Bhi Mahashivratri ki Lakh Crore Badhai , Thank You PitaJi , Hame Apni Sharan Me hi Rakhna","@गुरमीत्रमरहिम #ब्लॉकबस्टर्म्सग पिताजी , आप को भी महाशिवरात्रि की लाख क्रोर बढाई , थैंक यू पिताजी , हमे अपनी शरण मे ही रखना","@Gurmeetramrahim #BlockBusterMSG father, thousands of wishes of mahashivratri to you too, thank you father, keep me in your shelter.","@गुरमीत्रमरहिम #ब्लॉकबस्टर्म्सग Dad, you also got a million bucks on Mahashivratri, thank you Dad, keep us in your shelter."
RT @Viratian05 : Hindi - wo tyre kha gyi English - Ceat tyre,आरटी @विराटियन०५ : हिंदी - वो टायर खा गयी इंग्लिश - सीट टायर,RT @ Viratian05: Hindi - wo tyre kha gyi English - Ceat tyre,RT @विराटियन05: Hindi - That tyre ate English - Seat tyre
@BabaFirki bas abhi aankh khuli hai!,@बाबाफिरकी बस अभी आंख खुली है!,@BabaFirki only now the eyes have been opened!,@बाबाफिरकी Just got an eye-opener!
@TrulyMonica @greenpeaceindia bhookh lagi hai ?,@ट्रूलीमोनिका @ग्रीनपीसइंडिया भूख लगी है ?,@TrulyMonica @greenpeaceindia are you hungry?,@ट्रूलीमोनिका @ग्रीनपीसइंडिया Are you hungry?
kaise ho bhaijan???? eagerly waiting for 17th,कैसे हो भाईजान???? ईगर्ली वेटिंग फोर १७थ,how are you bhaijan???? eagerly waiting for 17th,How are you brother???? Eagerly waiting for the 17th
"@MeetUunngLee tujhe kasam hai Mia Khalifa ki, aisa kuch kiya toh","@मीटूँगली तुझे कसम है मिया खलीफा की, एआईएसए कुच किया तोह","@MeetUunngLee I swear you in the name of mia khalifa, if you did anything like this","@मीटूँगली You swear by Mia Khalifa, AISA crushed you"
guddu bhai ko standing problem hogayee .  .  .  . chalo pamela ke bahane kuch raunak toh aayee guddu ke kacche me  .  .  .  .  .  :d :d :d,गुड्डू भाई को स्टैंडिंग प्रॉब्लम होगयी .  .  .  . चलो पामेला के बहने कुच रौनक तोह आई गुड्डू के कच्चे मे  .  .  .  .  .  :डी :डी :डी,guddu has got a standing problem. at least because of pamela guddu’s underwear shines.,Guddu bhai got a standing problem.... let's go Pamela's sister kuch raunak toh aai Guddu ke kacche mein....: D: D: D
"humne jhagde solve kar liye hai, ab sirf pyar hai.","हमने झगड़े सॉल्व कर लिए है, अब सिर्फ प्यार है।","We have solved our problems, now it's only love between us.","We have resolved the quarrels, now there is only love."
@GaurangJB wahi to bol raha hu,@गौरंगजब वही तो बोल रहा हू,@GaurangJB that is what i am saying,@गौरंगजब That's what I'm talking about.
"hey guys tomorrow is now national ground hog day ,i hope to see you all post about it !!hahahaha","हे गाइज टॉमोरो इस नौ नेशनल ग्राउंड होग डे ,आई होप तो सी यू अल्ल पोस्ट अबाउट इट !!हहहहा","hey guys tomorrow is now national ground hog day ,i hope to see you all post about it !!hahahaha","Hey Guys Tomorrow is the National Ground Hog Day, I hope so you don't post about it!! hahahaha"
"Na bachi roti na bacha achaar

 #BadliyeSarkarBadliyeBihar","ना बची रोटी ना बचा अचार

 #बदलियेसरकारबदलियेबिहार","neither the chappati is left, nor the pickle is left  #BadliyeSarkarBadliyeBihar","No leftover bread, no leftover pickle #बदलियेसरकारबदलियेबिहार"
@Priyarathod2468 kabhi soncha hain aise bhi lag sakti hain vaat?  https://www.youtube.com/watch?v=CK4rf9T6OrI&feature=youtu.beÂ â€¦ #LagGayiVaat Shine,@प्रियरथोड़२४६८ कभी सोंचा हैं एआईएसई भी लग सकती हैं वात?  एचटीटीपीएस://डब्ल्यूडब्ल्यूडब्ल्यूडब्ल्यूडब्यूडब्ल्यूडब्यूडब्यूडब्यूडब्ल्यूडब्ल्यूडब्यूडब्ल्ल्यूडब्यूडब्ल्यूडब्यूडब्ल्यूडब्ल्यूडब्ल्यूडब्ल्ल्यूडब्यूडब्यूडब्ल्यूडब्यूडब्यूडब्यूडब्ल्यूडब्ल्यूडब्यूडब्यूडब्यूडब्यूडब्ल.यूट्यूब.कॉम/वॉच?व=के४आरएफ९टी६ओरी&फीचर=यूटू.बेâ â€¦ #लग्गयिवात शाइन,@Priyarathod2468 had you ever thought you could be in trouble like this? https://www.youtube.com/watch?v=CK4rf9T6OrI&feature=youtu.be #LagGayiVaat Shine,"@प्रियरथोड़2468 Ever thought AISE might be a thing? HTTPS: / / www.youtube.com / watch? = K4RF9T6ORI & Feature = यूटू.बेâ â €""Shine #लग्गयिवात"
sr ji 2 mnt xtra lay li....ab itne dr apko jyada baat krni.pdegi :*,एसआर जी २ मंत एक्सट्रा ले ली....अब इतने द्र आपको ज्यादा बात करनी.पड़ेगी :*,sir please 2 minutes... now you have to talk even more,SRG2 took the extra bit.... now that's more for you करनी.पड़ेगी: *
Good one recvd on #whatsapp Na Ishq Mein Hai Na Pyaar Mein Hai Jo Maza Pakistan Ki Haar Mein Hai #IndvsPak http://t.co/RlOL5QMFol,गुड ओने रेक्व्ड ओन #व्हाट्सएप ना इश्क में है ना प्यार में है जो मज़ा पाकिस्तान की हार में है #इंडवस्पैक एचटीटीपी://टी.सीओ/रोल५क्यूएमफोल,good one received on #whatsapp- the satisfaction that is there in pakistan's loss is not in love. #IndvsPak http://t.co/RlOL5QMFol,Good One Required Own #व्हाट्सएप Na ishq mein hai na pyaar mein hai jo mazaa Pakistan ki haar mein hai #इंडवस्पैक HTTP: / / T.CO / roll5QMfol
@byomkesbakshi Jaise hi pata chalega aapko sabse pehle soochit kiya jaega ,@ब्योमकेसबक्षी जैसे ही पता चलेगा आपको सबसे पहले सूचित किया जाएगा,),You will be notified as soon as @ब्योमकेसबक्षी is detected.
Aaj subah potty thik se hui. pet ekdum halka ho gaya. #BecauseOfNehru,आज सुबह पॉटी थिक से हुई. पेट एकदुम हल्का हो गया. #बेकौसेओफनेहरू,i shat well today morning. my stomach feels light. #BecauseOfNehru,Got a potty thick this morning. The belly is a little lighter. #बेकौसेओफनेहरू
@cynic_wall bipasha horror films zyada karti h . lovely ni :p,@सिनिक_वॉल बिपाशा हॉरर फिल्म्स ज्यादा करती ह . लवली नी :प,@cynic_wall bipasha does more horror films. Not lovely.,@सिनिक_वॉल Bipasha does more horror films.
Jo uthana nahi jaante unhe nuksaan uthana padta hai.,जो उठाना नही जानते उन्हे नुकसान उठाना पड़ता है।,those who don't know how to stand up have to face the loss.,Those who do not know how to lift have to suffer.
"Salman Khan Bail has prevented two news reports 

""Kya khaya pehli raat jail main Salman ne"" 

""Raat bhar karwat badalte rahe bhai""","सलमान खान बैल हास प्रिवेंटेड त्वो न्यूज रिपोर्ट्स 

""क्या खाया पहली रात जेल मैं सलमान ने"" 

""रात भर करवट बदलते रहे भाई""",salman khan bail has prevented two news reports,"Salman Khan Bull Haas Prevented TWO News Reports ""Kya khaaya pehli raat jail mein Salman ne"" ""Raat bhar karwaat badalte rahe bhai"""
"@shreekantmundra JDU jaegi har, ab aage badhega Bihar. #NitishKaNakliVikas","@श्रीकांतमुंद्रा जेडीयू जाएगी हर, अब आगे बढ़ेगा बिहार. #नितिष्कनकलिविकास","@shreekantmundra janata dal (united) will lose, now Bihar will develop. #NitishKaNakliVikas","@श्रीकांतमुंद्रा JDU will go every, now Bihar will go ahead. #नितिष्कनकलिविकास"
"@Alllahdin sab samajta hu main, pyar mein kabhi kabhi aisa ho jata hai","@अल्लाहदीन सब समजता हू मैं, प्यार में कभी कभी एआईएसए हो जाता है","@Alllahdin i will explain you everything, sometimes this happens in love..","@अल्लाहदीन All I understand is, in love sometimes AISA happens."
@Vyomnaut sab ek hi jaisi lagti hain ab to. Jaye to kaha jaye.,@व्योमनॉट सब एक ही जैसी लगती हैं अब तो. जाए तो कहा जाए।,@Vyomnaut sab ek hi jaisi lagti hain ab to. Should then be added.,@व्योमनॉट All look the same now.
"Kuch kuch milta hai anjali, tum nahi samjhogihttps://twitter.com/uPoliticat/status/864066951475216384 …","कुच कुच मिलता है अंजलि, तुम नही समझोगीहट्टप्स://ट्विटर.कॉम/अपोलिटिकेट/स्टेटस/८६४०६६९५१४७५२१६३८४ …","you get something anjali, you wont understand https://twitter.com/upoliticat/status/864066951475216384 …","Kuch kuch milta hai Anjali, you won't understandHutups: / / twitter.com / apoliticate / status / 864066951475216384..."
@TweetErrant bhai tu India America ke beech war karwaega,@ट्वीटरेंट भाई टू इंडिया अमेरिका के बीच वार करवाएगा,@TweetErrant brother you will cause a war between india and america.,@ट्वीटरेंट Brother to India will make war between America
"Ghotala @INCIndia ke raj me ho to #manmohansingh doshi "" bjp ke raj me ho to officials doshi .. aur ise kahte nishpaksh patrakarita .. mitroooooo ....... Na khaunga "" na khane dunga ..","घोटाला @इंसिंडिया के राज मे हो तो #मनमोहनसिंह दोषी "" बीजेपी के राज मे हो तो ऑफिशियल्स दोषी .. और इसे कहते निष्पक्ष पत्रकारिता .. मित्रूओ ....... ना खाऊंगा "" ना खाने दूंगा ..","If scam happens during reign of @INCIndia, #manmohansingh is believed guilty and if same happens during reign of BJP, officials are made guilty, and they say this as fair journalism, freinds I will not do corruption and will not allow anyone to do corruption ","If the scam is under the rule of @इंसिंडिया then #मनमोहनसिंह guilty. ""If it is under the rule of BJP, then the officials are guilty... and it is called fair journalism... friends...."
@realpreityzinta aaj kya anti himachal day hai .... Jo aap hum himachal waalo ko ignoring ðŸ˜¯ðŸ˜¯ðŸ˜‰ðŸ˜‚ #pzchat,@रियलप्रीतिज़िंता आज क्या अंति हिमाचल डे है .... जो आप हम हिमाचल वालो को इग्नोरिंग ðÿ˜¯ðÿ˜¯ðÿ˜‰ðÿ˜‚ #प्ज़चैट,@realpreityzinta what a anti himachal talk today which is ignoring for himachal living people like us   #pzchat,@रियलप्रीतिज़िंता What a last Himachal Day today.... Ignoring you and us Himachalis #प्ज़चैट
@chintskap sir aap ka to ye roz ka ho gaya hai. Pehle joke marte ho fir personal joke bol ke safe side ho jate ho.,@चिंतस्कप सिर आप का तो ये रोज का हो गया है. पहले जोक मारते हो फिर पर्सनल जोक बोल के सेफ साइड हो जाते हो।,"@chintskap Sir, it has become a routine for you. First you kill the jokies and then the personal jokes become safe side of the lyrics.",@चिंतस्कप Sir aap ka toh yeh roz ka ho gaya hai. Pehle jhok karte ho toh personal jhok bol ke safe side ho jaate ho.
tu hi rakh bhai. Thanks.,टू ही रख भाई. थैंक्स।,You only keep it. Thanks,Keep it up brother. Thank you.
@Ojasism bhai so ja,@ओजसिज्म भाई सो जा,"@Ojasism man, please sleep.","@ओजसिज्म Brother, go to sleep."
@sweetvismaya maha jhootha hai ye :),@स्वीटविस्मय महा झूठा है ये :),@SweetWisma this is a liar :),@स्वीटविस्मय Maha is a liar:)
@slimswamy yeh samajhna hi point hai bandhu.,@स्लिमस्वामी येह समझना ही पॉइंट है बंधु।,"@SlimSwamy, this is the point to understand, brothers.","@स्लिमस्वामी This is the point, my friend."
"Thank ""god KOI MIL GAYA was made in 2003 Abhi bani hoti to Jadu dhup dhup krta rehta aur milta sirf #pollution.","थैंक ""गोद कोई मिल गया वास मेड इन २००३ अभी बनी होती तो जादू धूप धूप करता रहता और मिलता सिर्फ #पॉल्यूशन।","Thank god KOI MIL GAYA was made in 2003, if it is made now, then Jadu will only search for sunlight, but what he gets is only #pollution.","Thank God someone found Was Made In 2003 had it been made now, the magic would have been sunshine and only #पॉल्यूशन would have got it."
